{
  "schema_version": "1.0.0",
  "corpus_id": "corpus:aaaaaaaaaaaaaaaaaaaaaaaaaaaaaaaaaaaaaaaaaaaaaaaaaaaaaaaaaaaaaaaa",
  "allowed_origins": [
    "synthetic"
  ],
  "members": [
    {
      "passage_id": "psg:eeeeeeeeeeeeeeeeeeeeeeeeeeeeeeeeeeeeeeeeeeeeeeeeeeeeeeeeeeeeeeee",
      "text_sha256": "aaaaaaaaaaaaaaaaaaaaaaaaaaaaaaaaaaaaaaaaaaaaaaaaaaaaaaaaaaaaaaaa",
      "representation_id": "repr:dddddddddddddddddddddddddddddddddddddddddddddddddddddddddddddddd",
      "work_id": "work:synthetic:shared-offline-control",
      "rights_id": "rights:cccccccccccccccccccccccccccccccccccccccccccccccccccccccccccccccc"
    }
  ],
  "excluded": [
    {
      "passage_id": "psg:ffffffffffffffffffffffffffffffffffffffffffffffffffffffffffffffff",
      "reason": "rights_not_indexable"
    }
  ],
  "counts": {
    "input_passages": 2,
    "members": 1,
    "excluded": 1
  }
}
